ID,name,description,url,created,last_modified,version,tactics,detection,platforms,data_sources,is_sub_technique,sub_technique_of,contributors,system_requirements,permissions_required,effective_permissions,defenses_bypassed,impact_type,supports_remote,mID
T1036,Masquerading,"Adversaries may attempt to manipulate features of their artifacts to make them appear legitimate or benign to users and/or security tools. Masquerading occurs when the name or location of an object, legitimate or malicious, is manipulated or abused for the sake of evading defenses and observation. This may include manipulating file metadata, tricking users into misidentifying the file type, and giving legitimate task or service names.

Renaming abusable system utilities to evade security monitoring is also a form of [Masquerading](https://attack.mitre.org/techniques/T1036).(Citation: LOLBAS Main Site)",https://attack.mitre.org/techniques/T1036,31-May-17,24-Apr-21,1.4,Defense Evasion,"Collect file hashes; file names that do not match their expected hash are suspect. Perform file monitoring; files with known names but in unusual locations are suspect. Likewise, files that are modified outside of an update or patch are suspect.

If file names are mismatched between the file name on disk and that of the binary's PE metadata, this is a likely indicator that a binary was renamed after it was compiled. Collecting and comparing disk and resource filenames for binaries by looking to see if the InternalName, OriginalFilename, and/or ProductName match what is expected could provide useful leads, but may not always be indicative of malicious activity. (Citation: Elastic Masquerade Ball) Do not focus on the possible names a file could have, but instead on the command-line arguments that are known to be used and are distinct because it will have a better rate of detection.(Citation: Twitter ItsReallyNick Masquerading Update)

Look for indications of common characters that may indicate an attempt to trick users into misidentifying the file type, such as a space as the last character of a file name or the right-to-left override characters""\u202E"", ""[U+202E]"", and ""%E2%80%AE”.","Containers, Linux, Windows, macOS","Command: Command Execution, File: File Metadata, File: File Modification, Image: Image Metadata, Process: Process Metadata, Scheduled Job: Scheduled Job Metadata, Scheduled Job: Scheduled Job Modification, Service: Service Creation, Service: Service Metadata",FALSE,,"Bartosz Jerzman; David Lu, Tripwire; Elastic; Felipe Espósito, @Pr0teus; Nick Carr, FireEye; Oleg Kolesnikov, Securonix",,,,Application control by file name or path,,,T1036
T1556,Modify Authentication Process,"Adversaries may modify authentication mechanisms and processes to access user credentials or enable otherwise unwarranted access to accounts. The authentication process is handled by mechanisms, such as the Local Security Authentication Server (LSASS) process and the Security Accounts Manager (SAM) on Windows, pluggable authentication modules (PAM) on Unix-based systems, and authorization plugins on MacOS systems, responsible for gathering, storing, and validating credentials. By modifying an authentication process, an adversary may be able to authenticate to a service or system without using [Valid Accounts](https://attack.mitre.org/techniques/T1078).

Adversaries may maliciously modify a part of this process to either reveal credentials or bypass authentication mechanisms. Compromised credentials or access may be used to bypass access controls placed on various resources on systems within the network and may even be used for persistent access to remote systems and externally available services, such as VPNs, Outlook Web Access and remote desktop.",https://attack.mitre.org/techniques/T1556,11-Feb-20,26-Apr-21,2,"Credential Access, Defense Evasion, Persistence","Monitor for new, unfamiliar DLL files written to a domain controller and/or local computer. Monitor for changes to Registry entries for password filters (ex: <code>HKEY_LOCAL_MACHINE\SYSTEM\CurrentControlSet\Control\Lsa\Notification Packages</code>) and correlate then investigate the DLL files these files reference. 

Password filters will also show up as an autorun and loaded DLL in lsass.exe.(Citation: Clymb3r Function Hook Passwords Sept 2013)

Monitor for calls to <code>OpenProcess</code> that can be used to manipulate lsass.exe running on a domain controller as well as for malicious modifications to functions exported from authentication-related system DLLs (such as cryptdll.dll and samsrv.dll).(Citation: Dell Skeleton) 

Monitor PAM configuration and module paths (ex: <code>/etc/pam.d/</code>) for changes. Use system-integrity tools such as AIDE and monitoring tools such as auditd to monitor PAM files.

Monitor for suspicious additions to the /Library/Security/SecurityAgentPlugins directory.(Citation: Xorrior Authorization Plugins)

Configure robust, consistent account activity audit policies across the enterprise and with externally accessible services. (Citation: TechNet Audit Policy) Look for suspicious account behavior across systems that share accounts, either user, admin, or service accounts. Examples: one account logged into multiple systems simultaneously; multiple accounts logged into the same machine simultaneously; accounts logged in at odd times or outside of business hours. Activity may be from interactive login sessions or process ownership from accounts being used to execute binaries on a remote system as a particular account. Correlate other security systems with login information (e.g., a user has an active login session but has not entered the building or does not have VPN access).","Linux, Network, Windows, macOS","File: File Creation, File: File Modification, Logon Session: Logon Session Creation, Module: Module Load, Process: OS API Execution, Process: Process Access, Windows Registry: Windows Registry Key Modification",FALSE,,Chris Ross @xorrior,,,,,,,T1556
T1578,Modify Cloud Compute Infrastructure,"An adversary may attempt to modify a cloud account's compute service infrastructure to evade defenses. A modification to the compute service infrastructure can include the creation, deletion, or modification of one or more components such as compute instances, virtual machines, and snapshots.

Permissions gained from the modification of infrastructure components may bypass restrictions that prevent access to existing infrastructure. Modifying infrastructure components may also allow an adversary to evade detection and remove evidence of their presence.(Citation: Mandiant M-Trends 2020)",https://attack.mitre.org/techniques/T1578,30-Aug-19,20-Apr-21,1.1,Defense Evasion,"Establish centralized logging for the activity of cloud compute infrastructure components. Monitor for suspicious sequences of events, such as the creation of multiple snapshots within a short period of time or the mount of a snapshot to a new instance by a new or unexpected user. To reduce false positives, valid change management procedures could introduce a known identifier that is logged with the change (e.g., tag or header) if supported by the cloud provider, to help distinguish valid, expected actions from malicious ones.",IaaS,"Instance: Instance Creation, Instance: Instance Deletion, Instance: Instance Modification, Instance: Instance Start, Instance: Instance Stop, Snapshot: Snapshot Creation, Snapshot: Snapshot Deletion, Snapshot: Snapshot Modification, Volume: Volume Creation, Volume: Volume Deletion, Volume: Volume Modification",FALSE,,,,,,,,,T1578
T1112,Modify Registry,"Adversaries may interact with the Windows Registry to hide configuration information within Registry keys, remove information as part of cleaning up, or as part of other techniques to aid in persistence and execution.

Access to specific areas of the Registry depends on account permissions, some requiring administrator-level access. The built-in Windows command-line utility [Reg](https://attack.mitre.org/software/S0075) may be used for local or remote Registry modification. (Citation: Microsoft Reg) Other tools may also be used, such as a remote access tool, which may contain functionality to interact with the Registry through the Windows API.

Registry modifications may also include actions to hide keys, such as prepending key names with a null character, which will cause an error and/or be ignored when read via [Reg](https://attack.mitre.org/software/S0075) or other utilities using the Win32 API. (Citation: Microsoft Reghide NOV 2006) Adversaries may abuse these pseudo-hidden keys to conceal payloads/commands used to maintain persistence. (Citation: TrendMicro POWELIKS AUG 2014) (Citation: SpectorOps Hiding Reg Jul 2017)

The Registry of a remote system may be modified to aid in execution of files as part of lateral movement. It requires the remote Registry service to be running on the target system. (Citation: Microsoft Remote) Often [Valid Accounts](https://attack.mitre.org/techniques/T1078) are required, along with access to the remote system's [SMB/Windows Admin Shares](https://attack.mitre.org/techniques/T1021/002) for RPC communication.",https://attack.mitre.org/techniques/T1112,31-May-17,13-Aug-20,1.2,Defense Evasion,"Modifications to the Registry are normal and occur throughout typical use of the Windows operating system. Consider enabling Registry Auditing on specific keys to produce an alertable event (Event ID 4657) whenever a value is changed (though this may not trigger when values are created with Reghide or other evasive methods). (Citation: Microsoft 4657 APR 2017) Changes to Registry entries that load software on Windows startup that do not correlate with known software, patch cycles, etc., are suspicious, as are additions or changes to files within the startup folder. Changes could also include new services and modification of existing binary paths to point to malicious files. If a change to a service-related entry occurs, then it will likely be followed by a local or remote service start or restart to execute the file.

Monitor processes and command-line arguments for actions that could be taken to change or delete information in the Registry. Remote access tools with built-in features may interact directly with the Windows API to gather information. The Registry may also be modified through Windows system management tools such as [Windows Management Instrumentation](https://attack.mitre.org/techniques/T1047) and [PowerShell](https://attack.mitre.org/techniques/T1059/001), which may require additional logging features to be configured in the operating system to collect necessary information for analysis.

Monitor for processes, command-line arguments, and API calls associated with concealing Registry keys, such as Reghide. (Citation: Microsoft Reghide NOV 2006) Inspect and cleanup malicious hidden Registry entries using Native Windows API calls and/or tools such as Autoruns (Citation: SpectorOps Hiding Reg Jul 2017) and RegDelNull (Citation: Microsoft RegDelNull July 2016).",Windows,"Command: Command Execution, Process: OS API Execution, Process: Process Creation, Windows Registry: Windows Registry Key Creation, Windows Registry: Windows Registry Key Deletion, Windows Registry: Windows Registry Key Modification",FALSE,,"Bartosz Jerzman; David Lu, Tripwire; Travis Smith, Tripwire",,,,Host forensic analysis,,,T1112
T1601,Modify System Image,"Adversaries may make changes to the operating system of embedded network devices to weaken defenses and provide new capabilities for themselves.  On such devices, the operating systems are typically monolithic and most of the device functionality and capabilities are contained within a single file.

To change the operating system, the adversary typically only needs to affect this one file, replacing or modifying it.  This can either be done live in memory during system runtime for immediate effect, or in storage to implement the change on the next boot of the network device.",https://attack.mitre.org/techniques/T1601,19-Oct-20,22-Oct-20,1,Defense Evasion,"Most embedded network devices provide a command to print the version of the currently running operating system.  Use this command to query the operating system for its version number and compare it to what is expected for the device in question.  Because this method may be used in conjunction with [Patch System Image](https://attack.mitre.org/techniques/T1601/001), it may be appropriate to also verify the integrity of the vendor provided operating system image file. 

Compare the checksum of the operating system file with the checksum of a known good copy from a trusted source.  Some embedded network device platforms may have the capability to calculate the checksum of the file, while others may not.  Even for those platforms that have the capability, it is recommended to download a copy of the file to a trusted computer to calculate the checksum with software that is not compromised.  (Citation: Cisco IOS Software Integrity Assurance - Image File Verification)

Many vendors of embedded network devices can provide advanced debugging support that will allow them to work with device owners to validate the integrity of the operating system running in memory.  If a compromise of the operating system is suspected, contact the vendor technical support and seek such services for a more thorough inspection of the current running system.  (Citation: Cisco IOS Software Integrity Assurance - Run-Time Memory Verification)",Network,File: File Modification,FALSE,,,,,,,,,T1601
T1104,Multi-Stage Channels,"Adversaries may create multiple stages for command and control that are employed under different conditions or for certain functions. Use of multiple stages may obfuscate the command and control channel to make detection more difficult.

Remote access tools will call back to the first-stage command and control server for instructions. The first stage may have automated capabilities to collect basic host information, update tools, and upload additional files. A second remote access tool (RAT) could be uploaded at that point to redirect the host to the second-stage command and control server. The second stage will likely be more fully featured and allow the adversary to interact with the system through a reverse shell and additional RAT features.

The different stages will likely be hosted separately with no overlapping infrastructure. The loader may also have backup first-stage callbacks or [Fallback Channels](https://attack.mitre.org/techniques/T1008) in case the original first-stage communication path is discovered and blocked.",https://attack.mitre.org/techniques/T1104,31-May-17,14-Jul-20,1,Command And Control,Host data that can relate unknown or suspicious process activity using a network connection is important to supplement any existing indicators of compromise based on malware command and control signatures and infrastructure. Relating subsequent actions that may result from Discovery of the system and network information or Lateral Movement to the originating process may also yield useful data.,"Linux, Windows, macOS","Network Traffic: Network Connection Creation, Network Traffic: Network Traffic Flow",FALSE,,,,,,,,,T1104
T1106,Native API,"Adversaries may directly interact with the native OS application programming interface (API) to execute behaviors. Native APIs provide a controlled means of calling low-level OS services within the kernel, such as those involving hardware/devices, memory, and processes.(Citation: NT API Windows)(Citation: Linux Kernel API) These native APIs are leveraged by the OS during system boot (when other system components are not yet initialized) as well as carrying out tasks and requests during routine operations.

Functionality provided by native APIs are often also exposed to user-mode applications via interfaces and libraries. For example, functions such as the Windows API <code>CreateProcess()</code> or GNU <code>fork()</code> will allow programs and scripts to start other processes.(Citation: Microsoft CreateProcess)(Citation: GNU Fork) This may allow API callers to execute a binary, run a CLI command, load modules, etc. as thousands of similar API functions exist for various system operations.(Citation: Microsoft Win32)(Citation: LIBC)(Citation: GLIBC)

Higher level software frameworks, such as Microsoft .NET and macOS Cocoa, are also available to interact with native APIs. These frameworks typically provide language wrappers/abstractions to API functionalities and are designed for ease-of-use/portability of code.(Citation: Microsoft NET)(Citation: Apple Core Services)(Citation: MACOS Cocoa)(Citation: macOS Foundation)

Adversaries may abuse these native API functions as a means of executing behaviors. Similar to [Command and Scripting Interpreter](https://attack.mitre.org/techniques/T1059), the native API and its hierarchy of interfaces, provide mechanisms to interact with and utilize various components of a victimized system.",https://attack.mitre.org/techniques/T1106,31-May-17,1-Jul-20,2,Execution,"Monitoring API calls may generate a significant amount of data and may not be useful for defense unless collected under specific circumstances, since benign use of API functions are common and difficult to distinguish from malicious behavior. Correlation of other events with behavior surrounding API function calls using API monitoring will provide additional context to an event that may assist in determining if it is due to malicious behavior. Correlation of activity by process lineage by process ID may be sufficient. 

Utilization of the Windows API may involve processes loading/accessing system DLLs associated with providing called functions (ex: kernel32.dll, advapi32.dll, user32.dll, and gdi32.dll). Monitoring for DLL loads, especially to abnormal/unusual or potentially malicious processes, may indicate abuse of the Windows API. Though noisy, this data can be combined with other indicators to identify adversary activity. ","Linux, Windows, macOS","Module: Module Load, Process: OS API Execution",FALSE,,Stefan Kanthak,,,,,,FALSE,T1106
T1599,Network Boundary Bridging,"Adversaries may bridge network boundaries by compromising perimeter network devices. Breaching these devices may enable an adversary to bypass restrictions on traffic routing that otherwise separate trusted and untrusted networks.

Devices such as routers and firewalls can be used to create boundaries between trusted and untrusted networks.  They achieve this by restricting traffic types to enforce organizational policy in an attempt to reduce the risk inherent in such connections.  Restriction of traffic can be achieved by prohibiting IP addresses, layer 4 protocol ports, or through deep packet inspection to identify applications.  To participate with the rest of the network, these devices can be directly addressable or transparent, but their mode of operation has no bearing on how the adversary can bypass them when compromised.

When an adversary takes control of such a boundary device, they can bypass its policy enforcement to pass normally prohibited traffic across the trust boundary between the two separated networks without hinderance.  By achieving sufficient rights on the device, an adversary can reconfigure the device to allow the traffic they want, allowing them to then further achieve goals such as command and control via [Multi-hop Proxy](https://attack.mitre.org/techniques/T1090/003) or exfiltration of data via [Traffic Duplication](https://attack.mitre.org/techniques/T1020/001).  In the cases where a border device separates two separate organizations, the adversary can also facilitate lateral movement into new victim environments.",https://attack.mitre.org/techniques/T1599,19-Oct-20,21-Oct-20,1,Defense Evasion,"Consider monitoring network traffic on both interfaces of border network devices with out-of-band packet capture or network flow data, using a different device than the one in question.  Look for traffic that should be prohibited by the intended network traffic policy enforcement for the border network device.

Monitor the border network device’s configuration to validate that the policy enforcement sections are what was intended.  Look for rules that are less restrictive, or that allow specific traffic types that were not previously authorized.",Network,"Network Traffic: Network Traffic Content, Network Traffic: Network Traffic Flow",FALSE,,,,,,"Firewall, Router ACL",,,T1599
T1498,Network Denial of Service,"Adversaries may perform Network Denial of Service (DoS) attacks to degrade or block the availability of targeted resources to users. Network DoS can be performed by exhausting the network bandwidth services rely on. Example resources include specific websites, email services, DNS, and web-based applications. Adversaries have been observed conducting network DoS attacks for political purposes(Citation: FireEye OpPoisonedHandover February 2016) and to support other malicious activities, including distraction(Citation: FSISAC FraudNetDoS September 2012), hacktivism, and extortion.(Citation: Symantec DDoS October 2014)

A Network DoS will occur when the bandwidth capacity of the network connection to a system is exhausted due to the volume of malicious traffic directed at the resource or the network connections and network devices the resource relies on. For example, an adversary may send 10Gbps of traffic to a server that is hosted by a network with a 1Gbps connection to the internet. This traffic can be generated by a single system or multiple systems spread across the internet, which is commonly referred to as a distributed DoS (DDoS).

To perform Network DoS attacks several aspects apply to multiple methods, including IP address spoofing, and botnets.

Adversaries may use the original IP address of an attacking system, or spoof the source IP address to make the attack traffic more difficult to trace back to the attacking system or to enable reflection. This can increase the difficulty defenders have in defending against the attack by reducing or eliminating the effectiveness of filtering by the source address on network defense devices.

For DoS attacks targeting the hosting system directly, see [Endpoint Denial of Service](https://attack.mitre.org/techniques/T1499).",https://attack.mitre.org/techniques/T1498,17-Apr-19,12-Apr-21,1.1,Impact,"Detection of Network DoS can sometimes be achieved before the traffic volume is sufficient to cause impact to the availability of the service, but such response time typically requires very aggressive monitoring and responsiveness or services provided by an upstream network service provider. Typical network throughput monitoring tools such as netflow(Citation: Cisco DoSdetectNetflow), SNMP, and custom scripts can be used to detect sudden increases in network or service utilization. Real-time, automated, and qualitative study of the network traffic can identify a sudden surge in one type of protocol can be used to detect an Network DoS event as it starts. Often, the lead time may be small and the indicator of an event availability of the network or service drops. The analysis tools mentioned can then be used to determine the type of DoS causing the outage and help with remediation.","Azure AD, Containers, Google Workspace, IaaS, Linux, Office 365, SaaS, Windows, macOS","Network Traffic: Network Traffic Flow, Sensor Health: Host Status",FALSE,,"Vishwas Manral, McAfee; Yossi Weizman, Azure Defender Research Team",,,,,Availability,,T1498
T1046,Network Service Scanning,"Adversaries may attempt to get a listing of services running on remote hosts, including those that may be vulnerable to remote software exploitation. Methods to acquire this information include port scans and vulnerability scans using tools that are brought onto a system. 

Within cloud environments, adversaries may attempt to discover services running on other cloud hosts. Additionally, if the cloud environment is connected to a on-premises environment, adversaries may be able to identify services running on non-cloud systems as well.",https://attack.mitre.org/techniques/T1046,31-May-17,9-Apr-21,2.2,Discovery,"System and network discovery techniques normally occur throughout an operation as an adversary learns the environment. Data and events should not be viewed in isolation, but as part of a chain of behavior that could lead to other activities, such as Lateral Movement, based on the information obtained.

Normal, benign system and network events from legitimate remote service scanning may be uncommon, depending on the environment and how they are used. Legitimate open port and vulnerability scanning may be conducted within the environment and will need to be deconflicted with any detection capabilities developed. Network intrusion detection systems can also be used to identify scanning activity. Monitor for process use of the networks and inspect intra-network flows to detect port scans.","Containers, IaaS, Linux, Windows, macOS","Cloud Service: Cloud Service Enumeration, Command: Command Execution, Network Traffic: Network Traffic Flow",FALSE,,Praetorian,,,,,,,T1046
