ID,name,description,url,created,last_modified,version,tactics,detection,platforms,data_sources,is_sub_technique,sub_technique_of,contributors,system_requirements,permissions_required,effective_permissions,defenses_bypassed,impact_type,supports_remote,mID
T1018,Remote System Discovery,"Adversaries may attempt to get a listing of other systems by IP address, hostname, or other logical identifier on a network that may be used for Lateral Movement from the current system. Functionality could exist within remote access tools to enable this, but utilities available on the operating system could also be used such as  [Ping](https://attack.mitre.org/software/S0097) or <code>net view</code> using [Net](https://attack.mitre.org/software/S0039). Adversaries may also use local host files (ex: <code>C:\Windows\System32\Drivers\etc\hosts</code> or <code>/etc/hosts</code>) in order to discover the hostname to IP address mappings of remote systems. 

Specific to macOS, the <code>bonjour</code> protocol exists to discover additional Mac-based systems within the same broadcast domain.",https://attack.mitre.org/techniques/T1018,31-May-17,13-Apr-21,3.1,Discovery,"System and network discovery techniques normally occur throughout an operation as an adversary learns the environment. Data and events should not be viewed in isolation, but as part of a chain of behavior that could lead to other activities, such as Lateral Movement, based on the information obtained.

Normal, benign system and network events related to legitimate remote system discovery may be uncommon, depending on the environment and how they are used. Monitor processes and command-line arguments for actions that could be taken to gather system and network information. Remote access tools with built-in features may interact directly with the Windows API to gather information. Information may also be acquired through Windows system management tools such as [Windows Management Instrumentation](https://attack.mitre.org/techniques/T1047) and [PowerShell](https://attack.mitre.org/techniques/T1059/001).

Monitor for processes that can be used to discover remote systems, such as <code>ping.exe</code> and <code>tracert.exe</code>, especially when executed in quick succession.(Citation: Elastic - Koadiac Detection with EQL)","Linux, Windows, macOS","Command: Command Execution, File: File Access, Network Traffic: Network Connection Creation, Process: Process Creation",FALSE,,"Daniel Stepanic, Elastic; RedHuntLabs, @redhuntlabs",,,,,,,T1018
T1091,Replication Through Removable Media,"Adversaries may move onto systems, possibly those on disconnected or air-gapped networks, by copying malware to removable media and taking advantage of Autorun features when the media is inserted into a system and executes. In the case of Lateral Movement, this may occur through modification of executable files stored on removable media or by copying malware and renaming it to look like a legitimate file to trick users into executing it on a separate system. In the case of Initial Access, this may occur through manual manipulation of the media, modification of systems used to initially format the media, or modification to the media's firmware itself.",https://attack.mitre.org/techniques/T1091,31-May-17,14-Jul-20,1,"Initial Access, Lateral Movement","Monitor file access on removable media. Detect processes that execute from removable media after it is mounted or when initiated by a user. If a remote access tool is used in this manner to move laterally, then additional actions are likely to occur after execution, such as opening network connections for Command and Control and system and network information Discovery.",Windows,"Drive: Drive Creation, File: File Access, File: File Creation, Process: Process Creation",FALSE,,,"Removable media allowed, Autorun enabled or vulnerability present that allows for code execution",,,,,,T1091
T1496,Resource Hijacking,"Adversaries may leverage the resources of co-opted systems in order to solve resource intensive problems which may impact system and/or hosted service availability. 

One common purpose for Resource Hijacking is to validate transactions of cryptocurrency networks and earn virtual currency. Adversaries may consume enough system resources to negatively impact and/or cause affected machines to become unresponsive.(Citation: Kaspersky Lazarus Under The Hood Blog 2017) Servers and cloud-based(Citation: CloudSploit - Unused AWS Regions) systems are common targets because of the high potential for available resources, but user endpoint systems may also be compromised and used for Resource Hijacking and cryptocurrency mining. Containerized environments may also be targeted due to the ease of deployment via exposed APIs and the potential for scaling mining activities by deploying or compromising multiple containers within an environment or cluster.(Citation: Unit 42 Hildegard Malware)(Citation: Trend Micro Exposed Docker APIs)

Additionally, some cryptocurrency mining malware kills off processes for competing malware to ensure it’s not competing for resources.(Citation: Trend Micro War of Crypto Miners)",https://attack.mitre.org/techniques/T1496,17-Apr-19,14-Apr-21,1.2,Impact,"Consider monitoring process resource usage to determine anomalous activity associated with malicious hijacking of computer resources such as CPU, memory, and graphics processing resources. Monitor for suspicious use of network resources associated with cryptocurrency mining software. Monitor for common cryptomining software process names and files on local systems that may indicate compromise and resource usage.","Containers, IaaS, Linux, Windows, macOS","Command: Command Execution, File: File Creation, Network Traffic: Network Connection Creation, Network Traffic: Network Traffic Flow, Process: Process Creation, Sensor Health: Host Status",FALSE,,"Alfredo Oliveira, Trend Micro; David Fiser, @anu4is, Trend Micro; Jay Chen, Palo Alto Networks; Magno Logan, @magnologan, Trend Micro; Vishwas Manral, McAfee; Yossi Weizman, Azure Defender Research Team",,,,,Availability,,T1496
T1207,Rogue Domain Controller,"Adversaries may register a rogue Domain Controller to enable manipulation of Active Directory data. DCShadow may be used to create a rogue Domain Controller (DC). DCShadow is a method of manipulating Active Directory (AD) data, including objects and schemas, by registering (or reusing an inactive registration) and simulating the behavior of a DC. (Citation: DCShadow Blog) Once registered, a rogue DC may be able to inject and replicate changes into AD infrastructure for any domain object, including credentials and keys.

Registering a rogue DC involves creating a new server and nTDSDSA objects in the Configuration partition of the AD schema, which requires Administrator privileges (either Domain or local to the DC) or the KRBTGT hash. (Citation: Adsecurity Mimikatz Guide)

This technique may bypass system logging and security monitors such as security information and event management (SIEM) products (since actions taken on a rogue DC may not be reported to these sensors). (Citation: DCShadow Blog) The technique may also be used to alter and delete replication and other associated metadata to obstruct forensic analysis. Adversaries may also utilize this technique to perform [SID-History Injection](https://attack.mitre.org/techniques/T1134/005) and/or manipulate AD objects (such as accounts, access control lists, schemas) to establish backdoors for Persistence. (Citation: DCShadow Blog)",https://attack.mitre.org/techniques/T1207,18-Apr-18,9-Feb-21,2,Defense Evasion,"Monitor and analyze network traffic associated with data replication (such as calls to DrsAddEntry, DrsReplicaAdd, and especially GetNCChanges) between DCs as well as to/from non DC hosts. (Citation: GitHub DCSYNCMonitor) (Citation: DCShadow Blog) DC replication will naturally take place every 15 minutes but can be triggered by an attacker or by legitimate urgent changes (ex: passwords). Also consider monitoring and alerting on the replication of AD objects (Audit Detailed Directory Service Replication Events 4928 and 4929). (Citation: DCShadow Blog)

Leverage AD directory synchronization (DirSync) to monitor changes to directory state using AD replication cookies. (Citation: Microsoft DirSync) (Citation: ADDSecurity DCShadow Feb 2018)

Baseline and periodically analyze the Configuration partition of the AD schema and alert on creation of nTDSDSA objects. (Citation: DCShadow Blog)

Investigate usage of Kerberos Service Principal Names (SPNs), especially those associated with services (beginning with “GC/”) by computers not present in the DC organizational unit (OU). The SPN associated with the Directory Replication Service (DRS) Remote Protocol interface (GUID E3514235–4B06–11D1-AB04–00C04FC2DCD2) can be set without logging. (Citation: ADDSecurity DCShadow Feb 2018) A rogue DC must authenticate as a service using these two SPNs for the replication process to successfully complete.",Windows,"Active Directory: Active Directory Object Creation, Active Directory: Active Directory Object Modification, Network Traffic: Network Traffic Content, User Account: User Account Authentication",FALSE,,Vincent Le Toux,,,,Log analysis,,,T1207
T1014,Rootkit,"Adversaries may use rootkits to hide the presence of programs, files, network connections, services, drivers, and other system components. Rootkits are programs that hide the existence of malware by intercepting/hooking and modifying operating system API calls that supply system information. (Citation: Symantec Windows Rootkits) 

Rootkits or rootkit enabling functionality may reside at the user or kernel level in the operating system or lower, to include a hypervisor, Master Boot Record, or [System Firmware](https://attack.mitre.org/techniques/T1542/001). (Citation: Wikipedia Rootkit) Rootkits have been seen for Windows, Linux, and Mac OS X systems. (Citation: CrowdStrike Linux Rootkit) (Citation: BlackHat Mac OSX Rootkit)",https://attack.mitre.org/techniques/T1014,31-May-17,20-Jun-20,1.1,Defense Evasion,"Some rootkit protections may be built into anti-virus or operating system software. There are dedicated rootkit detection tools that look for specific types of rootkit behavior. Monitor for the existence of unrecognized DLLs, devices, services, and changes to the MBR. (Citation: Wikipedia Rootkit)","Linux, Windows, macOS","Drive: Drive Modification, Firmware: Firmware Modification",FALSE,,,,,,"Anti-virus, Application control, Application control by file name or path, File monitoring, Host intrusion prevention systems, Signature-based detection, System access controls",,,T1014
T1053,Scheduled Task/Job,"Adversaries may abuse task scheduling functionality to facilitate initial or recurring execution of malicious code. Utilities exist within all major operating systems to schedule programs or scripts to be executed at a specified date and time. A task can also be scheduled on a remote system, provided the proper authentication is met (ex: RPC and file and printer sharing in Windows environments). Scheduling a task on a remote system typically requires being a member of an admin or otherwise privileged group on the remote system.(Citation: TechNet Task Scheduler Security)

Adversaries may use task scheduling to execute programs at system startup or on a scheduled basis for persistence. These mechanisms can also be abused to run a process under the context of a specified account (such as one with elevated permissions/privileges).",https://attack.mitre.org/techniques/T1053,31-May-17,20-Apr-21,2.1,"Execution, Persistence, Privilege Escalation","Monitor scheduled task creation from common utilities using command-line invocation. Legitimate scheduled tasks may be created during installation of new software or through system administration functions. Look for changes to tasks that do not correlate with known software, patch cycles, etc. 

Suspicious program execution through scheduled tasks may show up as outlier processes that have not been seen before when compared against historical data. Data and events should not be viewed in isolation, but as part of a chain of behavior that could lead to other activities, such as network connections made for Command and Control, learning details about the environment through Discovery, and Lateral Movement.","Containers, Linux, Windows, macOS","Command: Command Execution, Container: Container Creation, File: File Creation, File: File Modification, Process: Process Creation, Scheduled Job: Scheduled Job Creation",FALSE,,"Alain Homewood, Insomnia Security; Leo Loobeek, @leoloobeek; Prashant Verma, Paladion; Travis Smith, Tripwire",,"Administrator, SYSTEM, User","Administrator, SYSTEM, User",,,TRUE,T1053
T1029,Scheduled Transfer,"Adversaries may schedule data exfiltration to be performed only at certain times of day or at certain intervals. This could be done to blend traffic patterns with normal activity or availability.

When scheduled exfiltration is used, other exfiltration techniques likely apply as well to transfer the information out of the network, such as [Exfiltration Over C2 Channel](https://attack.mitre.org/techniques/T1041) or [Exfiltration Over Alternative Protocol](https://attack.mitre.org/techniques/T1048).",https://attack.mitre.org/techniques/T1029,31-May-17,28-Mar-20,1.1,Exfiltration,Monitor process file access patterns and network behavior. Unrecognized processes or scripts that appear to be traversing file systems and sending network traffic may be suspicious. Network connections to the same destination that occur at the same time of day for multiple days are suspicious.,"Linux, Windows, macOS","Network Traffic: Network Connection Creation, Network Traffic: Network Traffic Flow",FALSE,,,,,,,,,T1029
T1113,Screen Capture,"Adversaries may attempt to take screen captures of the desktop to gather information over the course of an operation. Screen capturing functionality may be included as a feature of a remote access tool used in post-compromise operations. Taking a screenshot is also typically possible through native utilities or API calls, such as <code>CopyFromScreen</code>, <code>xwd</code>, or <code>screencapture</code>.(Citation: CopyFromScreen .NET)(Citation: Antiquated Mac Malware)
",https://attack.mitre.org/techniques/T1113,31-May-17,24-Mar-20,1.1,Collection,"Monitoring for screen capture behavior will depend on the method used to obtain data from the operating system and write output files. Detection methods could include collecting information from unusual processes using API calls used to obtain image data, and monitoring for image files written to disk. The sensor data may need to be correlated with other events to identify malicious activity, depending on the legitimacy of this behavior within a given network environment.","Linux, Windows, macOS","Command: Command Execution, Process: OS API Execution",FALSE,,,,,,,,,T1113
T1597,Search Closed Sources,"Adversaries may search and gather information about victims from closed sources that can be used during targeting. Information about victims may be available for purchase from reputable private sources and databases, such as paid subscriptions to feeds of technical/threat intelligence data.(Citation: D3Secutrity CTI Feeds) Adversaries may also purchase information from less-reputable sources such as dark web or cybercrime blackmarkets.(Citation: ZDNET Selling Data)

Adversaries may search in different closed databases depending on what information they seek to gather. Information from these sources may reveal opportunities for other forms of reconnaissance (ex: [Phishing for Information](https://attack.mitre.org/techniques/T1598) or [Search Open Websites/Domains](https://attack.mitre.org/techniques/T1593)), establishing operational resources (ex: [Develop Capabilities](https://attack.mitre.org/techniques/T1587) or [Obtain Capabilities](https://attack.mitre.org/techniques/T1588)), and/or initial access (ex: [External Remote Services](https://attack.mitre.org/techniques/T1133) or [Valid Accounts](https://attack.mitre.org/techniques/T1078)).",https://attack.mitre.org/techniques/T1597,2-Oct-20,15-Apr-21,1,Reconnaissance,"Much of this activity may have a very high occurrence and associated false positive rate, as well as potentially taking place outside the visibility of the target organization, making detection difficult for defenders.

Detection efforts may be focused on related stages of the adversary lifecycle, such as during Initial Access.",PRE,,FALSE,,,,,,,,,T1597
T1596,Search Open Technical Databases,"Adversaries may search freely available technical databases for information about victims that can be used during targeting. Information about victims may be available in online databases and repositories, such as registrations of domains/certificates as well as public collections of network data/artifacts gathered from traffic and/or scans.(Citation: WHOIS)(Citation: DNS Dumpster)(Citation: Circl Passive DNS)(Citation: Medium SSL Cert)(Citation: SSLShopper Lookup)(Citation: DigitalShadows CDN)(Citation: Shodan)

Adversaries may search in different open databases depending on what information they seek to gather. Information from these sources may reveal opportunities for other forms of reconnaissance (ex: [Phishing for Information](https://attack.mitre.org/techniques/T1598) or [Search Open Websites/Domains](https://attack.mitre.org/techniques/T1593)), establishing operational resources (ex: [Acquire Infrastructure](https://attack.mitre.org/techniques/T1583) or [Compromise Infrastructure](https://attack.mitre.org/techniques/T1584)), and/or initial access (ex: [External Remote Services](https://attack.mitre.org/techniques/T1133) or [Trusted Relationship](https://attack.mitre.org/techniques/T1199)).",https://attack.mitre.org/techniques/T1596,2-Oct-20,15-Apr-21,1,Reconnaissance,"Much of this activity may have a very high occurrence and associated false positive rate, as well as potentially taking place outside the visibility of the target organization, making detection difficult for defenders.

Detection efforts may be focused on related stages of the adversary lifecycle, such as during Initial Access.",PRE,,FALSE,,,,,,,,,T1596
T1593,Search Open Websites/Domains,"Adversaries may search freely available websites and/or domains for information about victims that can be used during targeting. Information about victims may be available in various online sites, such as social media, new sites, or those hosting information about business operations such as hiring or requested/rewarded contracts.(Citation: Cyware Social Media)(Citation: SecurityTrails Google Hacking)(Citation: ExploitDB GoogleHacking)

Adversaries may search in different online sites depending on what information they seek to gather. Information from these sources may reveal opportunities for other forms of reconnaissance (ex: [Phishing for Information](https://attack.mitre.org/techniques/T1598) or [Search Open Technical Databases](https://attack.mitre.org/techniques/T1596)), establishing operational resources (ex: [Establish Accounts](https://attack.mitre.org/techniques/T1585) or [Compromise Accounts](https://attack.mitre.org/techniques/T1586)), and/or initial access (ex: [External Remote Services](https://attack.mitre.org/techniques/T1133) or [Phishing](https://attack.mitre.org/techniques/T1566)).",https://attack.mitre.org/techniques/T1593,2-Oct-20,15-Apr-21,1,Reconnaissance,"Much of this activity may have a very high occurrence and associated false positive rate, as well as potentially taking place outside the visibility of the target organization, making detection difficult for defenders.

Detection efforts may be focused on related stages of the adversary lifecycle, such as during Initial Access.",PRE,,FALSE,,,,,,,,,T1593
T1594,Search Victim-Owned Websites,"Adversaries may search websites owned by the victim for information that can be used during targeting. Victim-owned websites may contain a variety of details, including names of departments/divisions, physical locations, and data about key employees such as names, roles, and contact info (ex: [Email Addresses](https://attack.mitre.org/techniques/T1589/002)). These sites may also have details highlighting business operations and relationships.(Citation: Comparitech Leak)

Adversaries may search victim-owned websites to gather actionable information. Information from these sources may reveal opportunities for other forms of reconnaissance (ex: [Phishing for Information](https://attack.mitre.org/techniques/T1598) or [Search Open Technical Databases](https://attack.mitre.org/techniques/T1596)), establishing operational resources (ex: [Establish Accounts](https://attack.mitre.org/techniques/T1585) or [Compromise Accounts](https://attack.mitre.org/techniques/T1586)), and/or initial access (ex: [Trusted Relationship](https://attack.mitre.org/techniques/T1199) or [Phishing](https://attack.mitre.org/techniques/T1566)).",https://attack.mitre.org/techniques/T1594,2-Oct-20,15-Apr-21,1,Reconnaissance,"Monitor for suspicious network traffic that could be indicative of adversary reconnaissance, such as rapid successions of requests indicative of web crawling and/or large quantities of requests originating from a single source (especially if the source is known to be associated with an adversary). Analyzing web metadata may also reveal artifacts that can be attributed to potentially malicious activity, such as referer or user-agent string HTTP/S fields.",PRE,Application Log: Application Log Content,FALSE,,,,,,,,,T1594
T1505,Server Software Component,Adversaries may abuse legitimate extensible development features of servers to establish persistent access to systems. Enterprise server applications may include features that allow developers to write and install software or scripts to extend the functionality of the main application. Adversaries may install malicious components to extend and abuse server applications.,https://attack.mitre.org/techniques/T1505,28-Jun-19,16-Sep-20,1.1,Persistence,"Consider monitoring application logs for abnormal behavior that may indicate suspicious installation of application software components. Consider monitoring file locations associated with the installation of new application software components such as paths from which applications typically load such extensible components.

Process monitoring may be used to detect servers components that perform suspicious actions such as running cmd.exe or accessing files. Log authentication attempts to the server and any unusual traffic patterns to or from the server and internal network. (Citation: US-CERT Alert TA15-314A Web Shells) ","Linux, Windows, macOS","Application Log: Application Log Content, File: File Creation, File: File Modification, Network Traffic: Network Traffic Content, Network Traffic: Network Traffic Flow, Process: Process Creation",FALSE,,,,,,,,,T1505
T1489,Service Stop,"Adversaries may stop or disable services on a system to render those services unavailable to legitimate users. Stopping critical services or processes can inhibit or stop response to an incident or aid in the adversary's overall objectives to cause damage to the environment.(Citation: Talos Olympic Destroyer 2018)(Citation: Novetta Blockbuster) 

Adversaries may accomplish this by disabling individual services of high importance to an organization, such as <code>MSExchangeIS</code>, which will make Exchange content inaccessible (Citation: Novetta Blockbuster). In some cases, adversaries may stop or disable many or all services to render systems unusable.(Citation: Talos Olympic Destroyer 2018) Services or processes may not allow for modification of their data stores while running. Adversaries may stop services or processes in order to conduct [Data Destruction](https://attack.mitre.org/techniques/T1485) or [Data Encrypted for Impact](https://attack.mitre.org/techniques/T1486) on the data stores of services like Exchange and SQL Server.(Citation: SecureWorks WannaCry Analysis)",https://attack.mitre.org/techniques/T1489,29-Mar-19,2-Mar-21,1.2,Impact,"Monitor processes and command-line arguments to see if critical processes are terminated or stop running.

Monitor for edits for modifications to services and startup programs that correspond to services of high importance. Look for changes to services that do not correlate with known software, patch cycles, etc. Windows service information is stored in the Registry at <code>HKLM\SYSTEM\CurrentControlSet\Services</code>. Systemd service unit files are stored within the /etc/systemd/system, /usr/lib/systemd/system/, and /home/.config/systemd/user/ directories, as well as associated symbolic links.

Alterations to the service binary path or the service startup type changed to disabled may be suspicious.

Remote access tools with built-in features may interact directly with the Windows API to perform these functions outside of typical system utilities. For example, <code>ChangeServiceConfigW</code> may be used by an adversary to prevent services from starting.(Citation: Talos Olympic Destroyer 2018)","Linux, Windows, macOS","Command: Command Execution, File: File Modification, Process: OS API Execution, Process: Process Creation, Process: Process Termination, Service: Service Metadata, Windows Registry: Windows Registry Key Modification",FALSE,,,,,,,Availability,,T1489
