ID,name,description,url,created,last_modified,version,tactics,detection,platforms,data_sources,is_sub_technique,sub_technique_of,contributors,system_requirements,permissions_required,effective_permissions,defenses_bypassed,impact_type,supports_remote,mID
T1548,Abuse Elevation Control Mechanism,Adversaries may circumvent mechanisms designed to control elevate privileges to gain higher-level permissions. Most modern systems contain native elevation control mechanisms that are intended to limit privileges that a user can perform on a machine. Authorization has to be granted to specific users in order to perform tasks that can be considered of higher risk. An adversary can perform several methods to take advantage of built-in control mechanisms in order to escalate privileges on a system.,https://attack.mitre.org/techniques/T1548,30-Jan-20,22-Jul-20,1,"Defense Evasion, Privilege Escalation","Monitor the file system for files that have the setuid or setgid bits set. Also look for any process API calls for behavior that may be indicative of [Process Injection](https://attack.mitre.org/techniques/T1055) and unusual loaded DLLs through [DLL Search Order Hijacking](https://attack.mitre.org/techniques/T1574/001), which indicate attempts to gain access to higher privileged processes. On Linux, auditd can alert every time a user's actual ID and effective ID are different (this is what happens when you sudo).

Consider monitoring for <code>/usr/libexec/security_authtrampoline</code> executions which may indicate that AuthorizationExecuteWithPrivileges is being executed. MacOS system logs may also indicate when AuthorizationExecuteWithPrivileges is being called. Monitoring OS API callbacks for the execution can also be a way to detect this behavior but requires specialized security tooling.

On Linux, auditd can alert every time a user's actual ID and effective ID are different (this is what happens when you sudo). This technique is abusing normal functionality in macOS and Linux systems, but sudo has the ability to log all input and output based on the <code>LOG_INPUT</code> and <code>LOG_OUTPUT</code> directives in the <code>/etc/sudoers</code> file.

There are many ways to perform UAC bypasses when a user is in the local administrator group on a system, so it may be difficult to target detection on all variations. Efforts should likely be placed on mitigation and collecting enough information on process launches and actions that could be performed before and after a UAC bypass is performed. Some UAC bypass methods rely on modifying specific, user-accessible Registry settings. Analysts should monitor Registry settings for unauthorized changes.","Linux, Windows, macOS","Command: Command Execution, File: File Metadata, File: File Modification, Process: OS API Execution, Process: Process Creation, Process: Process Metadata, Windows Registry: Windows Registry Key Modification",FALSE,,,,"Administrator, User",,,,,T1548
T1134,Access Token Manipulation,"Adversaries may modify access tokens to operate under a different user or system security context to perform actions and bypass access controls. Windows uses access tokens to determine the ownership of a running process. A user can manipulate access tokens to make a running process appear as though it is the child of a different process or belongs to someone other than the user that started the process. When this occurs, the process also takes on the security context associated with the new token.

An adversary can use built-in Windows API functions to copy access tokens from existing processes; this is known as token stealing. These token can then be applied to an existing process (i.e. [Token Impersonation/Theft](https://attack.mitre.org/techniques/T1134/001)) or used to spawn a new process (i.e. [Create Process with Token](https://attack.mitre.org/techniques/T1134/002)). An adversary must already be in a privileged user context (i.e. administrator) to steal a token. However, adversaries commonly use token stealing to elevate their security context from the administrator level to the SYSTEM level. An adversary can then use a token to authenticate to a remote system as the account for that token if the account has appropriate permissions on the remote system.(Citation: Pentestlab Token Manipulation)

Any standard user can use the <code>runas</code> command, and the Windows API functions, to create impersonation tokens; it does not require access to an administrator account. There are also other mechanisms, such as Active Directory fields, that can be used to modify access tokens.",https://attack.mitre.org/techniques/T1134,14-Dec-17,24-Apr-21,2,"Defense Evasion, Privilege Escalation","If an adversary is using a standard command-line shell, analysts can detect token manipulation by auditing command-line activity. Specifically, analysts should look for use of the <code>runas</code> command. Detailed command-line logging is not enabled by default in Windows.(Citation: Microsoft Command-line Logging)

If an adversary is using a payload that calls the Windows token APIs directly, analysts can detect token manipulation only through careful analysis of user network activity, examination of running processes, and correlation with other endpoint and network behavior. 

There are many Windows API calls a payload can take advantage of to manipulate access tokens (e.g., <code>LogonUser</code> (Citation: Microsoft LogonUser), <code>DuplicateTokenEx</code>(Citation: Microsoft DuplicateTokenEx), and <code>ImpersonateLoggedOnUser</code>(Citation: Microsoft ImpersonateLoggedOnUser)). Please see the referenced Windows API pages for more information.

Query systems for process and thread token information and look for inconsistencies such as user owns processes impersonating the local SYSTEM account.(Citation: BlackHat Atkinson Winchester Token Manipulation)

Look for inconsistencies between the various fields that store PPID information, such as the EventHeader ProcessId from data collected via Event Tracing for Windows (ETW), Creator Process ID/Name from Windows event logs, and the ProcessID and ParentProcessID (which are also produced from ETW and other utilities such as Task Manager and Process Explorer). The ETW provided EventHeader ProcessId identifies the actual parent process.",Windows,"Active Directory: Active Directory Object Modification, Command: Command Execution, Process: OS API Execution, Process: Process Creation, Process: Process Metadata, User Account: User Account Metadata",FALSE,,"Jared Atkinson, @jaredcatkinson; Robby Winchester, @robwinchester3; Tom Ueltschi @c_APT_ure; Travis Smith, Tripwire",,"Administrator, User",SYSTEM,"File system access controls, Heuristic Detection, Host forensic analysis, System access controls, Windows User Account Control",,,T1134
T1531,Account Access Removal,"Adversaries may interrupt availability of system and network resources by inhibiting access to accounts utilized by legitimate users. Accounts may be deleted, locked, or manipulated (ex: changed credentials) to remove access to accounts.

Adversaries may also subsequently log off and/or reboot boxes to set malicious changes into place.(Citation: CarbonBlack LockerGoga 2019)(Citation: Unit42 LockerGoga 2019)",https://attack.mitre.org/techniques/T1531,9-Oct-19,14-Jul-20,1,Impact,"Use process monitoring to monitor the execution and command line parameters of binaries involved in deleting accounts or changing passwords, such as use of [Net](https://attack.mitre.org/software/S0039). Windows event logs may also designate activity associated with an adversary's attempt to remove access to an account:

* Event ID 4723 - An attempt was made to change an account's password
* Event ID 4724 - An attempt was made to reset an account's password
* Event ID 4726 - A user account was deleted
* Event ID 4740 - A user account was locked out

Alerting on [Net](https://attack.mitre.org/software/S0039) and these Event IDs may generate a high degree of false positives, so compare against baseline knowledge for how systems are typically used and correlate modification events with other indications of malicious activity where possible.","Linux, Windows, macOS","Active Directory: Active Directory Object Modification, User Account: User Account Deletion, User Account: User Account Modification",FALSE,,,,,,,Availability,,T1531
T1087,Account Discovery,Adversaries may attempt to get a listing of accounts on a system or within an environment. This information can help adversaries determine which accounts exist to aid in follow-on behavior.,https://attack.mitre.org/techniques/T1087,31-May-17,14-Apr-21,2.3,Discovery,"System and network discovery techniques normally occur throughout an operation as an adversary learns the environment. Data and events should not be viewed in isolation, but as part of a chain of behavior that could lead to other activities, such as Lateral Movement, based on the information obtained.

Monitor processes and command-line arguments for actions that could be taken to gather system and network information. Remote access tools with built-in features may interact directly with the Windows API to gather information. Information may also be acquired through Windows system management tools such as [Windows Management Instrumentation](https://attack.mitre.org/techniques/T1047) and [PowerShell](https://attack.mitre.org/techniques/T1059/001).

Monitor for processes that can be used to enumerate user accounts, such as <code>net.exe</code> and <code>net1.exe</code>, especially when executed in quick succession.(Citation: Elastic - Koadiac Detection with EQL)","Azure AD, Google Workspace, IaaS, Linux, Office 365, SaaS, Windows, macOS","Command: Command Execution, File: File Access, Process: Process Creation, User Account: User Account Metadata",FALSE,,"Daniel Stepanic, Elastic; Microsoft Threat Intelligence Center (MSTIC); Travis Smith, Tripwire",,,,,,,T1087
T1098,Account Manipulation,"Adversaries may manipulate accounts to maintain access to victim systems. Account manipulation may consist of any action that preserves adversary access to a compromised account, such as modifying credentials or permission groups. These actions could also include account activity designed to subvert security policies, such as performing iterative password updates to bypass password duration policies and preserve the life of compromised credentials. In order to create or manipulate accounts, the adversary must already have sufficient permissions on systems or the domain.",https://attack.mitre.org/techniques/T1098,31-May-17,20-Apr-21,2.2,Persistence,"Collect events that correlate with changes to account objects and/or permissions on systems and the domain, such as event IDs 4738, 4728 and 4670.(Citation: Microsoft User Modified Event)(Citation: Microsoft Security Event 4670)(Citation: Microsoft Security Event 4670) Monitor for modification of accounts in correlation with other suspicious activity. Changes may occur at unusual times or from unusual systems. Especially flag events where the subject and target accounts differ(Citation: InsiderThreat ChangeNTLM July 2017) or that include additional flags such as changing a password without knowledge of the old password.(Citation: GitHub Mimikatz Issue 92 June 2017)

Monitor for use of credentials at unusual times or to unusual systems or services. This may also correlate with other suspicious activity.

Monitor for unusual permissions changes that may indicate excessively broad permissions being granted to compromised accounts.","Azure AD, Google Workspace, IaaS, Linux, Office 365, Windows, macOS","Active Directory: Active Directory Object Modification, Command: Command Execution, File: File Modification, Group: Group Modification, Process: Process Creation, User Account: User Account Modification",FALSE,,"Jannie Li, Microsoft Threat Intelligence Center (MSTIC); Praetorian; Tim MalcomVetter",,,,,,,T1098
T1583,Acquire Infrastructure,"Adversaries may buy, lease, or rent infrastructure that can be used during targeting. A wide variety of infrastructure exists for hosting and orchestrating adversary operations. Infrastructure solutions include physical or cloud servers, domains, and third-party web services.(Citation: TrendmicroHideoutsLease) Additionally, botnets are available for rent or purchase.

Use of these infrastructure solutions allows an adversary to stage, launch, and execute an operation. Solutions may help adversary operations blend in with traffic that is seen as normal, such as contact to third-party web services. Depending on the implementation, adversaries may use infrastructure that makes it difficult to physically tie back to them as well as utilize infrastructure that can be rapidly provisioned, modified, and shut down.",https://attack.mitre.org/techniques/T1583,30-Sep-20,15-Apr-21,1,Resource Development,"Consider use of services that may aid in tracking of newly acquired infrastructure, such as WHOIS databases for domain registration information. Much of this activity may take place outside the visibility of the target organization, making detection of this behavior difficult.

Detection efforts may be focused on related stages of the adversary lifecycle, such as during Command and Control.",PRE,,FALSE,,,,,,,,,T1583
T1595,Active Scanning,"Adversaries may execute active reconnaissance scans to gather information that can be used during targeting. Active scans are those where the adversary probes victim infrastructure via network traffic, as opposed to other forms of reconnaissance that do not involve direct interaction.

Adversaries may perform different forms of active scanning depending on what information they seek to gather. These scans can also be performed in various ways, including using native features of network protocols such as ICMP.(Citation: Botnet Scan)(Citation: OWASP Fingerprinting) Information from these scans may reveal opportunities for other forms of reconnaissance (ex: [Search Open Websites/Domains](https://attack.mitre.org/techniques/T1593) or [Search Open Technical Databases](https://attack.mitre.org/techniques/T1596)), establishing operational resources (ex: [Develop Capabilities](https://attack.mitre.org/techniques/T1587) or [Obtain Capabilities](https://attack.mitre.org/techniques/T1588)), and/or initial access (ex: [External Remote Services](https://attack.mitre.org/techniques/T1133) or [Exploit Public-Facing Application](https://attack.mitre.org/techniques/T1190)).",https://attack.mitre.org/techniques/T1595,2-Oct-20,15-Apr-21,1,Reconnaissance,"Monitor for suspicious network traffic that could be indicative of scanning, such as large quantities originating from a single source (especially if the source is known to be associated with an adversary/botnet). Analyzing web metadata may also reveal artifacts that can be attributed to potentially malicious activity, such as referer or user-agent string HTTP/S fields.

Much of this activity may have a very high occurrence and associated false positive rate, as well as potentially taking place outside the visibility of the target organization, making detection difficult for defenders.

Detection efforts may be focused on related stages of the adversary lifecycle, such as during Initial Access.",PRE,"Network Traffic: Network Traffic Content, Network Traffic: Network Traffic Flow",FALSE,,,,,,,,,T1595
T1071,Application Layer Protocol,"Adversaries may communicate using application layer protocols to avoid detection/network filtering by blending in with existing traffic. Commands to the remote system, and often the results of those commands, will be embedded within the protocol traffic between the client and server. 

Adversaries may utilize many different protocols, including those used for web browsing, transferring files, electronic mail, or DNS. For connections that occur internally within an enclave (such as those between a proxy or pivot node and other nodes), commonly used protocols are SMB, SSH, or RDP. ",https://attack.mitre.org/techniques/T1071,31-May-17,21-Oct-20,2,Command And Control,"Analyze network data for uncommon data flows (e.g., a client sending significantly more data than it receives from a server). Processes utilizing the network that do not normally have network communication or have never been seen before are suspicious. Analyze packet contents to detect application layer protocols that do not follow the expected protocol standards regarding syntax, structure, or any other variable adversaries could leverage to conceal data.(Citation: University of Birmingham C2)","Linux, Windows, macOS","Network Traffic: Network Traffic Content, Network Traffic: Network Traffic Flow",FALSE,,,,,,,,,T1071
T1010,Application Window Discovery,Adversaries may attempt to get a listing of open application windows. Window listings could convey information about how the system is used or give context to information collected by a keylogger.,https://attack.mitre.org/techniques/T1010,31-May-17,26-Mar-20,1.1,Discovery,"System and network discovery techniques normally occur throughout an operation as an adversary learns the environment. Data and events should not be viewed in isolation, but as part of a chain of behavior that could lead to other activities based on the information obtained.

Monitor processes and command-line arguments for actions that could be taken to gather system and network information. Remote access tools with built-in features may interact directly with the Windows API to gather information. Information may also be acquired through Windows system management tools such as [Windows Management Instrumentation](https://attack.mitre.org/techniques/T1047) and [PowerShell](https://attack.mitre.org/techniques/T1059/001).","Windows, macOS","Command: Command Execution, Process: OS API Execution, Process: Process Creation",FALSE,,,,,,,,,T1010
T1560,Archive Collected Data,"An adversary may compress and/or encrypt data that is collected prior to exfiltration. Compressing the data can help to obfuscate the collected data and minimize the amount of data sent over the network. Encryption can be used to hide information that is being exfiltrated from detection or make exfiltration less conspicuous upon inspection by a defender.

Both compression and encryption are done prior to exfiltration, and can be performed using a utility, 3rd party library, or custom method.",https://attack.mitre.org/techniques/T1560,20-Feb-20,21-Oct-20,1,Collection,"Archival software and archived files can be detected in many ways. Common utilities that may be present on the system or brought in by an adversary may be detectable through process monitoring and monitoring for command-line arguments for known archival utilities. This may yield a significant number of benign events, depending on how systems in the environment are typically used.

A process that loads the Windows DLL crypt32.dll may be used to perform encryption, decryption, or verification of file signatures.

Consider detecting writing of files with extensions and/or headers associated with compressed or encrypted file types. Detection efforts may focus on follow-on exfiltration activity, where compressed or encrypted files can be detected in transit with a network intrusion detection or data loss prevention system analyzing file headers.(Citation: Wikipedia File Header Signatures)","Linux, Windows, macOS","Command: Command Execution, File: File Creation, Process: Process Creation, Script: Script Execution",FALSE,,,,,,,,,T1560
T1123,Audio Capture,"An adversary can leverage a computer's peripheral devices (e.g., microphones and webcams) or applications (e.g., voice and video call services) to capture audio recordings for the purpose of listening into sensitive conversations to gather information.

Malware or scripts may be used to interact with the devices through an available API provided by the operating system or an application to capture audio. Audio files may be written to disk and exfiltrated later.",https://attack.mitre.org/techniques/T1123,31-May-17,14-Jul-20,1,Collection,"Detection of this technique may be difficult due to the various APIs that may be used. Telemetry data regarding API use may not be useful depending on how a system is normally used, but may provide context to other potentially malicious activity occurring on a system.

Behavior that could indicate technique use include an unknown or unusual process accessing APIs associated with devices or software that interact with the microphone, recording devices, or recording software, and a process periodically writing files to disk that contain audio data.","Linux, Windows, macOS","Command: Command Execution, Process: OS API Execution",FALSE,,,,,,,,,T1123
T1119,Automated Collection,"Once established within a system or network, an adversary may use automated techniques for collecting internal data. Methods for performing this technique could include use of a [Command and Scripting Interpreter](https://attack.mitre.org/techniques/T1059) to search for and copy information fitting set criteria such as file type, location, or name at specific time intervals. This functionality could also be built into remote access tools. 

This technique may incorporate use of other techniques such as [File and Directory Discovery](https://attack.mitre.org/techniques/T1083) and [Lateral Tool Transfer](https://attack.mitre.org/techniques/T1570) to identify and move files.",https://attack.mitre.org/techniques/T1119,31-May-17,31-Mar-20,1,Collection,"Depending on the method used, actions could include common file system commands and parameters on the command-line interface within batch files or scripts. A sequence of actions like this may be unusual, depending on the system and network environment. Automated collection may occur along with other techniques such as [Data Staged](https://attack.mitre.org/techniques/T1074). As such, file access monitoring that shows an unusual process performing sequential file opens and potentially copy actions to another location on the file system for many files at once may indicate automated collection behavior. Remote access tools with built-in features may interact directly with the Windows API to gather data. Data may also be acquired through Windows system management tools such as [Windows Management Instrumentation](https://attack.mitre.org/techniques/T1047) and [PowerShell](https://attack.mitre.org/techniques/T1059/001).","Linux, Windows, macOS","Command: Command Execution, File: File Access, Script: Script Execution",FALSE,,,Permissions to access directories and files that store information of interest.,,,,,,T1119
T1020,Automated Exfiltration,"Adversaries may exfiltrate data, such as sensitive documents, through the use of automated processing after being gathered during Collection. 

When automated exfiltration is used, other exfiltration techniques likely apply as well to transfer the information out of the network, such as [Exfiltration Over C2 Channel](https://attack.mitre.org/techniques/T1041) and [Exfiltration Over Alternative Protocol](https://attack.mitre.org/techniques/T1048).",https://attack.mitre.org/techniques/T1020,31-May-17,22-Apr-21,1.2,Exfiltration,Monitor process file access patterns and network behavior. Unrecognized processes or scripts that appear to be traversing file systems and sending network traffic may be suspicious.,"Linux, Network, Windows, macOS","Command: Command Execution, File: File Access, Network Traffic: Network Connection Creation, Network Traffic: Network Traffic Content, Network Traffic: Network Traffic Flow, Script: Script Execution",FALSE,,ExtraHop,,,,,,,T1020
