ID,name,description,url,created,last_modified,version,tactics,detection,platforms,data_sources,is_sub_technique,sub_technique_of,contributors,system_requirements,permissions_required,effective_permissions,defenses_bypassed,impact_type,supports_remote,mID
T1484,Domain Policy Modification,"Adversaries may modify the configuration settings of a domain to evade defenses and/or escalate privileges in domain environments. Domains provide a centralized means of managing how computer resources (ex: computers, user accounts) can act, and interact with each other, on a network. The policy of the domain also includes configuration settings that may apply between domains in a multi-domain/forest environment. Modifications to domain settings may include altering domain Group Policy Objects (GPOs) or changing trust settings for domains, including federation trusts.

With sufficient permissions, adversaries can modify domain policy settings. Since domain configuration settings control many of the interactions within the Active Directory (AD) environment, there are a great number of potential attacks that can stem from this abuse. Examples of such abuse include modifying GPOs to push a malicious [Scheduled Task](https://attack.mitre.org/techniques/T1053/005) to computers throughout the domain environment(Citation: ADSecurity GPO Persistence 2016)(Citation: Wald0 Guide to GPOs)(Citation: Harmj0y Abusing GPO Permissions) or modifying domain trusts to include an adversary controlled domain where they can control access tokens that will subsequently be accepted by victim domain resources.(Citation: Microsoft - Customer Guidance on Recent Nation-State Cyber Attacks) Adversaries can also change configuration settings within the AD environment to implement a [Rogue Domain Controller](https://attack.mitre.org/techniques/T1207).

Adversaries may temporarily modify domain policy, carry out a malicious action(s), and then revert the change to remove suspicious indicators.",https://attack.mitre.org/techniques/T1484,7-Mar-19,9-Feb-21,2,"Defense Evasion, Privilege Escalation","It may be possible to detect domain policy modifications using Windows event logs. Group policy modifications, for example, may be logged under a variety of Windows event IDs for modifying, creating, undeleting, moving, and deleting directory service objects (Event ID 5136, 5137, 5138, 5139, 5141 respectively). Monitor for modifications to domain trust settings, such as when a user or application modifies the federation settings on the domain or updates domain authentication from Managed to Federated via ActionTypes <code>Set federation settings on domain</code> and <code>Set domain authentication</code>.(Citation: Microsoft - Azure Sentinel ADFSDomainTrustMods)(Citation: Microsoft 365 Defender Solorigate) This may also include monitoring for Event ID 307 which can be correlated to relevant Event ID 510 with the same Instance ID for change details.(Citation: Sygnia Golden SAML)(Citation: CISA SolarWinds Cloud Detection)

Consider monitoring for commands/cmdlets and command-line arguments that may be leveraged to modify domain policy settings.(Citation: Microsoft - Update or Repair Federated domain) Some domain policy modifications, such as changes to federation settings, are likely to be rare.(Citation: Microsoft 365 Defender Solorigate)","Azure AD, Windows","Active Directory: Active Directory Object Creation, Active Directory: Active Directory Object Deletion, Active Directory: Active Directory Object Modification, Command: Command Execution",FALSE,,,,"Administrator, User",,"File system access controls, System access controls",,,T1484
T1482,Domain Trust Discovery,"Adversaries may attempt to gather information on domain trust relationships that may be used to identify lateral movement opportunities in Windows multi-domain/forest environments. Domain trusts provide a mechanism for a domain to allow access to resources based on the authentication procedures of another domain.(Citation: Microsoft Trusts) Domain trusts allow the users of the trusted domain to access resources in the trusting domain. The information discovered may help the adversary conduct [SID-History Injection](https://attack.mitre.org/techniques/T1134/005), [Pass the Ticket](https://attack.mitre.org/techniques/T1550/003), and [Kerberoasting](https://attack.mitre.org/techniques/T1558/003).(Citation: AdSecurity Forging Trust Tickets)(Citation: Harmj0y Domain Trusts) Domain trusts can be enumerated using the `DSEnumerateDomainTrusts()` Win32 API call, .NET methods, and LDAP.(Citation: Harmj0y Domain Trusts) The Windows utility [Nltest](https://attack.mitre.org/software/S0359) is known to be used by adversaries to enumerate domain trusts.(Citation: Microsoft Operation Wilysupply)",https://attack.mitre.org/techniques/T1482,14-Feb-19,17-Sep-20,1.1,Discovery,"System and network discovery techniques normally occur throughout an operation as an adversary learns the environment. Data and events should not be viewed in isolation but as part of a chain of behavior that could lead to other activities based on the information obtained.

Monitor processes and command-line arguments for actions that could be taken to gather system and network information, such as `nltest /domain_trusts`. Remote access tools with built-in features may interact directly with the Windows API to gather information. Look for the `DSEnumerateDomainTrusts()` Win32 API call to spot activity associated with [Domain Trust Discovery](https://attack.mitre.org/techniques/T1482).(Citation: Harmj0y Domain Trusts) Information may also be acquired through Windows system management tools such as [PowerShell](https://attack.mitre.org/techniques/T1059/001). The .NET method `GetAllTrustRelationships()` can be an indicator of [Domain Trust Discovery](https://attack.mitre.org/techniques/T1482).(Citation: Microsoft GetAllTrustRelationships)
",Windows,"Command: Command Execution, Process: OS API Execution, Process: Process Creation, Script: Script Execution",FALSE,,"Dave Westgard; Elia Florio, Microsoft; Mnemonic; RedHuntLabs, @redhuntlabs",,,,,,,T1482
T1189,Drive-by Compromise,"Adversaries may gain access to a system through a user visiting a website over the normal course of browsing. With this technique, the user's web browser is typically targeted for exploitation, but adversaries may also use compromised websites for non-exploitation behavior such as acquiring [Application Access Token](https://attack.mitre.org/techniques/T1550/001).

Multiple ways of delivering exploit code to a browser exist, including:

* A legitimate website is compromised where adversaries have injected some form of malicious code such as JavaScript, iFrames, and cross-site scripting.
* Malicious ads are paid for and served through legitimate ad providers.
* Built-in web application interfaces are leveraged for the insertion of any other kind of object that can be used to display web content or contain a script that executes on the visiting client (e.g. forum posts, comments, and other user controllable web content).

Often the website used by an adversary is one visited by a specific community, such as government, a particular industry, or region, where the goal is to compromise a specific user or set of users based on a shared interest. This kind of targeted attack is referred to a strategic web compromise or watering hole attack. There are several known examples of this occurring.(Citation: Shadowserver Strategic Web Compromise)

Typical drive-by compromise process:

1. A user visits a website that is used to host the adversary controlled content.
2. Scripts automatically execute, typically searching versions of the browser and plugins for a potentially vulnerable version. 
    * The user may be required to assist in this process by enabling scripting or active website components and ignoring warning dialog boxes.
3. Upon finding a vulnerable version, exploit code is delivered to the browser.
4. If exploitation is successful, then it will give the adversary code execution on the user's system unless other protections are in place.
    * In some cases a second visit to the website after the initial scan is required before exploit code is delivered.

Unlike [Exploit Public-Facing Application](https://attack.mitre.org/techniques/T1190), the focus of this technique is to exploit software on a client endpoint upon visiting a website. This will commonly give an adversary access to systems on the internal network instead of external systems that may be in a DMZ.

Adversaries may also use compromised websites to deliver a user to a malicious application designed to [Steal Application Access Token](https://attack.mitre.org/techniques/T1528)s, like OAuth tokens, to gain access to protected applications and information. These malicious applications have been delivered through popups on legitimate websites.(Citation: Volexity OceanLotus Nov 2017)",https://attack.mitre.org/techniques/T1189,18-Apr-18,29-Mar-20,1.2,Initial Access,"Firewalls and proxies can inspect URLs for potentially known-bad domains or parameters. They can also do reputation-based analytics on websites and their requested resources such as how old a domain is, who it's registered to, if it's on a known bad list, or how many other users have connected to it before.

Network intrusion detection systems, sometimes with SSL/TLS MITM inspection, can be used to look for known malicious scripts (recon, heap spray, and browser identification scripts have been frequently reused), common script obfuscation, and exploit code.

Detecting compromise based on the drive-by exploit from a legitimate website may be difficult. Also look for behavior on the endpoint system that might indicate successful compromise, such as abnormal behavior of browser processes. This could include suspicious files written to disk, evidence of [Process Injection](https://attack.mitre.org/techniques/T1055) for attempts to hide execution, evidence of Discovery, or other unusual network traffic that may indicate additional tools transferred to the system.","Linux, SaaS, Windows, macOS","Application Log: Application Log Content, File: File Creation, Network Traffic: Network Connection Creation, Network Traffic: Network Traffic Content, Process: Process Creation",FALSE,,"Jeff Sakowicz, Microsoft Identity Developer Platform Services (IDPM Services); Saisha Agrawal, Microsoft Threat Intelligent Center (MSTIC)",,,,,,,T1189
T1568,Dynamic Resolution,"Adversaries may dynamically establish connections to command and control infrastructure to evade common detections and remediations. This may be achieved by using malware that shares a common algorithm with the infrastructure the adversary uses to receive the malware's communications. These calculations can be used to dynamically adjust parameters such as the domain name, IP address, or port number the malware uses for command and control.

Adversaries may use dynamic resolution for the purpose of [Fallback Channels](https://attack.mitre.org/techniques/T1008). When contact is lost with the primary command and control server malware may employ dynamic resolution as a means to reestablishing command and control.(Citation: Talos CCleanup 2017)(Citation: FireEye POSHSPY April 2017)(Citation: ESET Sednit 2017 Activity)",https://attack.mitre.org/techniques/T1568,10-Mar-20,2-Oct-20,1,Command And Control,"Detecting dynamically generated C2 can be challenging due to the number of different algorithms, constantly evolving malware families, and the increasing complexity of the algorithms. There are multiple approaches to detecting a pseudo-randomly generated domain name, including using frequency analysis, Markov chains, entropy, proportion of dictionary words, ratio of vowels to other characters, and more (Citation: Data Driven Security DGA). CDN domains may trigger these detections due to the format of their domain names. In addition to detecting algorithm generated domains based on the name, another more general approach for detecting a suspicious domain is to check for recently registered names or for rarely visited domains.","Linux, Windows, macOS","Network Traffic: Network Connection Creation, Network Traffic: Network Traffic Content, Network Traffic: Network Traffic Flow",FALSE,,Chris Roffe,,,,,,,T1568
T1114,Email Collection,"Adversaries may target user email to collect sensitive information. Emails may contain sensitive data, including trade secrets or personal information, that can prove valuable to adversaries. Adversaries can collect or forward email from mail servers or clients. ",https://attack.mitre.org/techniques/T1114,31-May-17,14-Apr-21,2.2,Collection,"There are likely a variety of ways an adversary could collect email from a target, each with a different mechanism for detection.

File access of local system email files for Exfiltration, unusual processes connecting to an email server within a network, or unusual access patterns or authentication attempts on a public-facing webmail server may all be indicators of malicious activity.

Monitor processes and command-line arguments for actions that could be taken to gather local email files. Remote access tools with built-in features may interact directly with the Windows API to gather information. Information may also be acquired through Windows system management tools such as [Windows Management Instrumentation](https://attack.mitre.org/techniques/T1047) and [PowerShell](https://attack.mitre.org/techniques/T1059/001).

Detection is challenging because all messages forwarded because of an auto-forwarding rule have the same presentation as a manually forwarded message. It is also possible for the user to not be aware of the addition of such an auto-forwarding rule and not suspect that their account has been compromised; email-forwarding rules alone will not affect the normal usage patterns or operations of the email account.

Auto-forwarded messages generally contain specific detectable artifacts that may be present in the header; such artifacts would be platform-specific. Examples include <code>X-MS-Exchange-Organization-AutoForwarded</code> set to true, <code>X-MailFwdBy</code> and <code>X-Forwarded-To</code>. The <code>forwardingSMTPAddress</code> parameter used in a forwarding process that is managed by administrators and not by user actions. All messages for the mailbox are forwarded to the specified SMTP address. However, unlike typical client-side rules, the message does not appear as forwarded in the mailbox; it appears as if it were sent directly to the specified destination mailbox.(Citation: Microsoft Tim McMichael Exchange Mail Forwarding 2) High volumes of emails that bear the <code>X-MS-Exchange-Organization-AutoForwarded</code> header (indicating auto-forwarding) without a corresponding number of emails that match the appearance of a forwarded message may indicate that further investigation is needed at the administrator level rather than user-level.","Google Workspace, Office 365, Windows","Application Log: Application Log Content, Command: Command Execution, File: File Access, Logon Session: Logon Session Creation, Network Traffic: Network Connection Creation",FALSE,,"Swetha Prabakaran, Microsoft Threat Intelligence Center (MSTIC)",,,,,,,T1114
T1573,Encrypted Channel,"Adversaries may employ a known encryption algorithm to conceal command and control traffic rather than relying on any inherent protections provided by a communication protocol. Despite the use of a secure algorithm, these implementations may be vulnerable to reverse engineering if secret keys are encoded and/or generated within malware samples/configuration files.",https://attack.mitre.org/techniques/T1573,16-Mar-20,20-Apr-21,1,Command And Control,"SSL/TLS inspection is one way of detecting command and control traffic within some encrypted communication channels.(Citation: SANS Decrypting SSL) SSL/TLS inspection does come with certain risks that should be considered before implementing to avoid potential security issues such as incomplete certificate validation.(Citation: SEI SSL Inspection Risks)

In general, analyze network data for uncommon data flows (e.g., a client sending significantly more data than it receives from a server). Processes utilizing the network that do not normally have network communication or have never been seen before are suspicious. Analyze packet contents to detect communications that do not follow the expected protocol behavior for the port that is being used.(Citation: University of Birmingham C2)","Linux, Windows, macOS",Network Traffic: Network Traffic Content,FALSE,,,,,,,,,T1573
T1499,Endpoint Denial of Service,"Adversaries may perform Endpoint Denial of Service (DoS) attacks to degrade or block the availability of services to users. Endpoint DoS can be performed by exhausting the system resources those services are hosted on or exploiting the system to cause a persistent crash condition. Example services include websites, email services, DNS, and web-based applications. Adversaries have been observed conducting DoS attacks for political purposes(Citation: FireEye OpPoisonedHandover February 2016) and to support other malicious activities, including distraction(Citation: FSISAC FraudNetDoS September 2012), hacktivism, and extortion.(Citation: Symantec DDoS October 2014)

An Endpoint DoS denies the availability of a service without saturating the network used to provide access to the service. Adversaries can target various layers of the application stack that is hosted on the system used to provide the service. These layers include the Operating Systems (OS), server applications such as web servers, DNS servers, databases, and the (typically web-based) applications that sit on top of them. Attacking each layer requires different techniques that take advantage of bottlenecks that are unique to the respective components. A DoS attack may be generated by a single system or multiple systems spread across the internet, which is commonly referred to as a distributed DoS (DDoS).

To perform DoS attacks against endpoint resources, several aspects apply to multiple methods, including IP address spoofing and botnets.

Adversaries may use the original IP address of an attacking system, or spoof the source IP address to make the attack traffic more difficult to trace back to the attacking system or to enable reflection. This can increase the difficulty defenders have in defending against the attack by reducing or eliminating the effectiveness of filtering by the source address on network defense devices.

Botnets are commonly used to conduct DDoS attacks against networks and services. Large botnets can generate a significant amount of traffic from systems spread across the global internet. Adversaries may have the resources to build out and control their own botnet infrastructure or may rent time on an existing botnet to conduct an attack. In some of the worst cases for DDoS, so many systems are used to generate requests that each one only needs to send out a small amount of traffic to produce enough volume to exhaust the target's resources. In such circumstances, distinguishing DDoS traffic from legitimate clients becomes exceedingly difficult. Botnets have been used in some of the most high-profile DDoS attacks, such as the 2012 series of incidents that targeted major US banks.(Citation: USNYAG IranianBotnet March 2016)

In cases where traffic manipulation is used, there may be points in the the global network (such as high traffic gateway routers) where packets can be altered and cause legitimate clients to execute code that directs network packets toward a target in high volume. This type of capability was previously used for the purposes of web censorship where client HTTP traffic was modified to include a reference to JavaScript that generated the DDoS code to overwhelm target web servers.(Citation: ArsTechnica Great Firewall of China)

For attacks attempting to saturate the providing network, see [Network Denial of Service](https://attack.mitre.org/techniques/T1498).
",https://attack.mitre.org/techniques/T1499,18-Apr-19,14-Apr-21,1.1,Impact,"Detection of Endpoint DoS can sometimes be achieved before the effect is sufficient to cause significant impact to the availability of the service, but such response time typically requires very aggressive monitoring and responsiveness. Typical network throughput monitoring tools such as netflow, SNMP, and custom scripts can be used to detect sudden increases in circuit utilization.(Citation: Cisco DoSdetectNetflow) Real-time, automated, and qualitative study of the network traffic can identify a sudden surge in one type of protocol can be used to detect an attack as it starts.

In addition to network level detections, endpoint logging and instrumentation can be useful for detection. Attacks targeting web applications may generate logs in the web server, application server, and/or database server that can be used to identify the type of attack, possibly before the impact is felt.

Externally monitor the availability of services that may be targeted by an Endpoint DoS.","Azure AD, Containers, Google Workspace, IaaS, Linux, Office 365, SaaS, Windows, macOS","Application Log: Application Log Content, Network Traffic: Network Traffic Content, Network Traffic: Network Traffic Flow, Sensor Health: Host Status",FALSE,,"Alfredo Oliveira, Trend Micro; David Fiser, @anu4is, Trend Micro; Magno Logan, @magnologan, Trend Micro; Vishwas Manral, McAfee; Yossi Weizman, Azure Defender Research Team",,,,,Availability,,T1499
T1611,Escape to Host,"Adversaries may break out of a container to gain access to the underlying host. This can allow an adversary access to other containerized resources from the host level or to the host itself. In principle, containerized resources should provide a clear separation of application functionality and be isolated from the host environment.(Citation: Docker Overview)

There are multiple ways an adversary may escape to a host environment. Examples include creating a container configured to mount the host’s filesystem using the bind parameter, which allows the adversary to drop payloads and execute control utilities such as cron on the host, and utilizing a privileged container to run commands on the underlying host.(Citation: Docker Bind Mounts)(Citation: Trend Micro Privileged Container)(Citation: Intezer Doki July 20) Gaining access to the host may provide the adversary with the opportunity to achieve follow-on objectives, such as establishing persistence, moving laterally within the environment, or setting up a command and control channel on the host.",https://attack.mitre.org/techniques/T1611,30-Mar-21,22-Apr-21,1,Privilege Escalation,"Monitor for the deployment of suspicious or unknown container images and pods in your environment, particularly containers running as root. Additionally, monitor for unexpected usage of syscalls such as <code>mount</code> (as well as resulting process activity) that may indicate an attempt to escape from a privileged container to host. In Kubernetes, monitor for cluster-level events associated with changing containers' volume configurations.","Containers, Linux, Windows","Container: Container Creation, Process: OS API Execution, Process: Process Creation",FALSE,,"Alfredo Oliveira, Trend Micro; Ariel Shuper, Cisco; David Fiser, @anu4is, Trend Micro; Idan Frimark, Cisco; Joas Antonio dos Santos, @C0d3Cr4zy, Inmetrics; Magno Logan, @magnologan, Trend Micro; Vishwas Manral, McAfee; Yossi Weizman, Azure Defender Research Team",,"Administrator, User, root",,,,,T1611
T1585,Establish Accounts,"Adversaries may create and cultivate accounts with services that can be used during targeting. Adversaries can create accounts that can be used to build a persona to further operations. Persona development consists of the development of public information, presence, history and appropriate affiliations. This development could be applied to social media, website, or other publicly available information that could be referenced and scrutinized for legitimacy over the course of an operation using that persona or identity.(Citation: NEWSCASTER2014)(Citation: BlackHatRobinSage)

For operations incorporating social engineering, the utilization of an online persona may be important. These personas may be fictitious or impersonate real people. The persona may exist on a single site or across multiple sites (ex: Facebook, LinkedIn, Twitter, Google, GitHub, Docker Hub, etc.). Establishing a persona may require development of additional documentation to make them seem real. This could include filling out profile information, developing social networks, or incorporating photos.(Citation: NEWSCASTER2014)(Citation: BlackHatRobinSage)

Establishing accounts can also include the creation of accounts with email providers, which may be directly leveraged for [Phishing for Information](https://attack.mitre.org/techniques/T1598) or [Phishing](https://attack.mitre.org/techniques/T1566).(Citation: Mandiant APT1)",https://attack.mitre.org/techniques/T1585,1-Oct-20,15-Apr-21,1.1,Resource Development,"Consider monitoring social media activity related to your organization. Suspicious activity may include personas claiming to work for your organization or recently created/modified accounts making numerous connection requests to accounts affiliated with your organization.

Much of this activity will take place outside the visibility of the target organization, making detection of this behavior difficult. Detection efforts may be focused on related stages of the adversary lifecycle, such as during Initial Access (ex: [Phishing](https://attack.mitre.org/techniques/T1566)).",PRE,,FALSE,,,,,,,,,T1585
